rank,title,author,publisher,pub_date,price_normal,price_sale,rating,isbn,link
1,손현보 목사의 항소이유서,"손현보, 정승윤",미래사,,16200,16200,8.4,	9788970871745,https://www.yes24.com/product/goods/188907649
2,정책실의 과학자들,"박수경, 박현민",21세기북스,,17100,17100,,	9791173579950,https://www.yes24.com/product/goods/189013411
3,가족 해방,"에이먼 돌런, 김은지",복복서가,,17100,17100,,	9791194996187,https://www.yes24.com/product/goods/189011252
4,완전체 영어 수업 : 구글과 AI로 구현하는 4 Skills의 기적,"유병선, 임선아, 임소정, 홍진우",앤써북,,15930,15930,,	9791193059852,https://www.yes24.com/product/goods/189216092
5,이것은 왜 오렌지주스인가,"자크 프롤리히, 김태호, 김병순",따비,2026년 05월,33000,29700,,	9791192169637,https://www.yes24.com/product/goods/189410536
6,깨어 있는 척하는 기업들,"비벡 라마스와미, 김태훈",한국경제신문,2026년 05월,25000,22500,,	9788947502672,https://www.yes24.com/product/goods/189409473
7,민사집행의실무 부동산경매 1,손흥수,한국사법행정학회,2026년 04월,96000,96000,,	9788981098674,https://www.yes24.com/product/goods/189409189
8,민사집행의실무 부동산경매 2,손흥수,한국사법행정학회,2026년 04월,107000,107000,,	9788981098681,https://www.yes24.com/product/goods/189409188
9,기본 사회가 온다,정균승,프롬북스,2026년 05월,25000,22500,,	9791194550174,https://www.yes24.com/product/goods/189409096
10,레이건,"크레이그 셜리, 윤희석",메디치미디어,2026년 05월,25000,22500,6.0,	9791157065592,https://www.yes24.com/product/goods/189407581
11,"리더십, 한국어 교실을 바꾸다 (큰글자책)","김한훈, 이현, 오미진, 안지수, 류효정, 정보 더 보기/감추기, 김한훈, 이현, 오미진, 안지수, 류효정, 한다경",피톤치드,2026년 05월,39000,39000,,	9791192549675,https://www.yes24.com/product/goods/189407211
12,이제 헌법을 바꿀 시간입니다 (큰글자책),김예찬,루아크,2026년 05월,30000,30000,,	9791194391371,https://www.yes24.com/product/goods/189407174
13,미 상호주의 대응수산분야 비관세장벽 영향 연구,"이정미, 정명화, 조경준",한국해양수산개발원,2026년 04월,15000,15000,,	9791168662858,https://www.yes24.com/product/goods/189385992
14,부산항 터미널 위험물 컨테이너 장치 효율 개선 방안 연구: 법·제도 측면,"김우선, 허재영",한국해양수산개발원,2026년 02월,15000,15000,,	9791168662834,https://www.yes24.com/product/goods/189385991
15,군소도서국 해양수산 국제협력 방안 수립,"전혜은, 한덕훈, 김주형, 이민정, 임해주, 허재영",한국해양수산개발원,2026년 02월,15000,15000,,	9791168662766,https://www.yes24.com/product/goods/189385990
16,청년의 지역 이동과 정착: 일-삶-락-연 기반의 청년친화지수와 정책방향,"김지수, 허문구, 유이선",산업연구원,2025년 12월,12000,12000,,	9791194827498,https://www.yes24.com/product/goods/189385983
17,전력인프라용 핵심소재의 공급망 분석과 정책적 시사점,"이고은, 이재윤, 문지원",산업연구원,2025년 12월,4000,4000,,	9791194827849,https://www.yes24.com/product/goods/189385982
18,국가연구개발사업의 기업 효과성 분석,이준영,산업연구원,2026년 01월,4000,4000,,	9791194827832,https://www.yes24.com/product/goods/189385981
19,국내 임차공장 현황과 입지 유형별 특성,정진영,산업연구원,2025년 12월,4000,4000,,	9791194827726,https://www.yes24.com/product/goods/189385980
20,회복탄력성 관점에서 바라본 개발도상국의 기후변화 대응 과제와 협력 방안,"이은석, 오지영, 정지선, 이예림, 김유리",대외경제정책연구원,2026년 01월,10000,10000,,	9788932219516,https://www.yes24.com/product/goods/189385979
21,지역 청년고용정책에 대한 효과성 분석과 전략수립 연구,"최용환, 임지연, 좌동훈",한국청소년정책연구원,2025년 12월,7000,7000,,	9791156544708,https://www.yes24.com/product/goods/189385977
22,청년 친화적인 지역인재양성 및 일자리 창출 방안 2,"최용환, 임지연, 좌동훈, 박윤수, 이동성",한국청소년정책연구원,2025년 12월,7000,7000,,	9791156544609,https://www.yes24.com/product/goods/189385976
23,사우디아라비아와 UAE의 AI산업전략과 정책 시사점,"이권형, 이현진, 강반디, 이다운",대외경제정책연구원,2026년 04월,7000,7000,,	9788932261539,https://www.yes24.com/product/goods/189385974
24,사회복지역사,이성기,공동체,2026년 05월,26000,26000,,	9791175541481,https://www.yes24.com/product/goods/189385973
25,교육의 이유,김종만,지노,2026년 05월,17000,15300,,	9791193878422,https://www.yes24.com/product/goods/189385970
26,경제학 미소스,곽수원,박영스토리,2026년 05월,18000,18000,,	9791172792626,https://www.yes24.com/product/goods/189385966
27,진징이 교수 추모 선집 제1권,진징이,한울아카데미,2026년 05월,50000,50000,,	9788946076426,https://www.yes24.com/product/goods/189381035
28,진징이 교수 추모 선집 제 2권,진징이,한울아카데미,2026년 04월,40000,40000,,	9788946076433,https://www.yes24.com/product/goods/189381036
29,아이돌봄 지원법 개정에 따른 하위 법령 정비 방향 연구,"김소영, 정가원, 구미영, 권소영, 구혜령",한국여성정책연구원,2026년 04월,16000,16000,,	9791166522031,https://www.yes24.com/product/goods/189378352
30,친밀한 관계 기반 폭력 대응 및 피해자 보호 강화를 위한 법제화 연구,"박상민, 홍미리, 정다은, 전윤경",한국여성정책연구원,2026년 04월,17000,17000,,	9791166522048,https://www.yes24.com/product/goods/189378347
31,자영업과 자영업정책,오상봉,한국노동연구원,2025년 12월,5000,5000,,	9791126008445,https://www.yes24.com/product/goods/189377137
32,문화 거버넌스 연구,현영란,자유전선,2024년 12월,25000,22500,,	9791195717224,https://www.yes24.com/product/goods/189375884
33,다카이치 총리 돌풍의 비밀,박갑주,새빛,2026년 05월,22000,19800,10.0,	9791194885405,https://www.yes24.com/product/goods/189363040
34,케어리스 피플,"세라 윈윌리엄스, 안진환",디플롯,2026년 05월,23000,20700,,	9791193591529,https://www.yes24.com/product/goods/189340493
35,한 여성 살인범의 초상,"후무칭, 김주희",글항아리,2026년 05월,25000,22500,,	9791169095556,https://www.yes24.com/product/goods/189339477
36,차별을 훔치는 남자들 (큰글자도서),박정훈,한겨레출판,2026년 04월,33000,33000,,	9791172134051,https://www.yes24.com/product/goods/189336222
37,제로 포인트,"슬라보예 지젝, 배세진, 이혜진",우중몽,2026년 05월,19000,17100,,	9791199651111,https://www.yes24.com/product/goods/189335937
38,미리 쓰는 미래 교육,미래학교자치연구소,기역,2026년 05월,27000,24300,,	9791194533313,https://www.yes24.com/product/goods/189335887
39,국가선택,우원규,미래의창,2026년 05월,18000,16200,10.0,	9791124073254,https://www.yes24.com/product/goods/189250186
40,마을이 답이다,"권상동, 마을만들기전국네트워크, 거버넌스센터",휴머니즘,2026년 05월,22000,19800,,	9791185571430,https://www.yes24.com/product/goods/189247633
41,"AI 교육전쟁, 사고력만이 살아남는다",유민종,좋은땅,2026년 05월,17000,15300,,	9791138859202,https://www.yes24.com/product/goods/189247552
42,가르치지 않을 용기,김영찬,우리학교,2026년 05월,18000,16200,,	9791167553829,https://www.yes24.com/product/goods/189247390
43,2025년 사회조사보고서,,국가데이터처,2025년 12월,12000,12000,,	9771228950705,https://www.yes24.com/product/goods/189247151
44,AI 도입의 결정요인 및 성과 분석 - 사업체패널조사 자료를 이용하여,"이경희, 김정우, 김기민, 김향아, 고대영",한국노동연구원,2025년 12월,7000,7000,,	9791126008483,https://www.yes24.com/product/goods/189233071
45,기후변화 시대의 환경윤리학,"매리언 아워드킨, 노희정",연암서가,2026년 05월,25000,25000,,	9791160871586,https://www.yes24.com/product/goods/189230824
46,"AI 시대, 아이의 격차는 부모에게서 시작된다",이화영,가디언,2026년 05월,19000,17100,,	9791167782014,https://www.yes24.com/product/goods/189225198
47,당신이 미처 몰랐던 국방이야기,최한영,어깨위망원경,2026년 04월,17800,16020,,	9791193200780,https://www.yes24.com/product/goods/189223770
48,탁월한 피해자,곽아람,생각의힘,2026년 05월,19800,17820,,	9791194880868,https://www.yes24.com/product/goods/189218553
50,신과 국가,"미하일 바쿠닌, 김용석",미행,2026년 05월,17000,15300,,	9791192004457,https://www.yes24.com/product/goods/189192517
51,감사대응 실무 매뉴얼,지유현,박영사,2026년 05월,27000,27000,,	9791130396637,https://www.yes24.com/product/goods/189192515
52,검사의 시각으로 쉽게 풀어낸 형사증거법 강의,한제희,박영사,2026년 05월,26000,26000,,	9791130398464,https://www.yes24.com/product/goods/189192514
53,배후세계의 사회,송해룡,시간의물레,2026년 05월,27000,24300,,	9788965115915,https://www.yes24.com/product/goods/189192513
54,"교육, 아름다운 흔들림",이민철,씨아이알(CIR),2026년 05월,23000,23000,,	9791168563681,https://www.yes24.com/product/goods/189190258
55,제갈량이 본 미국 우주전략,김훈,바른북스,2026년 05월,21000,18900,,	9791176212205,https://www.yes24.com/product/goods/189189116
56,디지털금융 기초 법률 상식,정세진,한국금융연수원,2026년 05월,21000,21000,,	9788928707577,https://www.yes24.com/product/goods/189188022
57,사랑받는 서점을 만들기 위해 2000일 동안 내가 한 일,"하야시 유타카, 유서윤",한스미디어,2026년 05월,18000,16200,,	9791124272398,https://www.yes24.com/product/goods/189187839
58,윤리 있는 정치 정치 있는 윤리,홍창민,이소노미아,2026년 05월,20000,18000,,	9791190844710,https://www.yes24.com/product/goods/189187561
59,보존을 넘어 공존으로,"금기형, 김덕순, 김영재, 안재홍, 전진성",학고재,2026년 05월,22000,19800,,	9788956254791,https://www.yes24.com/product/goods/189186739
60,미국은 왜?,"세르주 알리미, 크리스토프 방튀라, 성일권, 질베르 아슈카르, 필리프 데캉, 정보 더 보기/감추기, 세르주 알리미, 크리스토프 방튀라, 성일권, 질베르 아슈카르, 필리프 데캉, 브누아 브레빌",르몽드코리아,2026년 05월,18000,16200,,	9791124485026,https://www.yes24.com/product/goods/189185274
61,격랑 속의 자유,송희복,북랩,2026년 05월,18000,16200,,	9791175982673,https://www.yes24.com/product/goods/189185128
62,미국의 민주주의 1,"알렉시 드 토크빌, 임효선, 박지동",한길사,2026년 04월,38000,38000,,	9788935679232,https://www.yes24.com/product/goods/189184934
63,지구의 질문 (큰글자책),공우석,드레북스,2026년 05월,35000,35000,,	9791193946732,https://www.yes24.com/product/goods/189184338
64,해석노동 (큰글자책),양정호,생각비행,2026년 05월,27000,27000,,	9791192745855,https://www.yes24.com/product/goods/189184291
65,권력과 복종,강준만,이글루,2026년 05월,20000,18000,2.0,	9791199457188,https://www.yes24.com/product/goods/189183010
66,아서 클라인먼,김관욱,커뮤니케이션북스,2026년 05월,12000,12000,,	9791143026156,https://www.yes24.com/product/goods/189182921
67,아서 클라인먼 (큰글자책),김관욱,커뮤니케이션북스,2026년 05월,25000,25000,,	9791143026163,https://www.yes24.com/product/goods/189182923
68,KINU 통일의식조사 세트(2025),이상신,통일연구원,2025년 12월,15000,15000,,	9791165892296,https://www.yes24.com/product/goods/189159684
69,아이들이 내게 가르쳐 준 것,차상수,성림원북스,2026년 05월,17800,16020,10.0,	9791124072257,https://www.yes24.com/product/goods/189123980
70,우리 아이 디지털 능력,김주희,이비락,2026년 05월,18000,16200,,	9788962452471,https://www.yes24.com/product/goods/189123207
71,메가시티 공간전략 실현을 위한 광역도시계획 기능 제고 방안,"윤정재, 김중은, 정민기, 노원준, 박대근",국토연구원,2025년 10월,8000,7600,,	9791173500466,https://www.yes24.com/product/goods/189119431
72,철도 및 도로 지하화를 통한 미래 도시공간 혁신방안 연구,"조미향, 김중은, 김승훈, 김동준, 김미화, 김충호, 이관옥",국토연구원,2025년 10월,8000,7600,,	9791173500541,https://www.yes24.com/product/goods/189119430
73,스마트도시 확산을 위한 성과관리체계 구축 방안 연구,"김익회, 노원준, 구형수, 방설아, 신서경, 최경아, 김영현",국토연구원,2025년 10월,8000,7600,,	9791173500558,https://www.yes24.com/product/goods/189119429
74,건설산업 조기경보시스템(EWS)구축을 위한 기초연구,"신진욱, 표희진, 황관석, 김민철, 이승훈, 이종소, 이승연",국토연구원,2025년 12월,7000,6650,,	9791173500619,https://www.yes24.com/product/goods/189119428
75,"대축소 시대, 건설·부동산의 미래와 대응 전략","정동호, 노민지, 전성제, 유현지, 방설아, 석재성, 이형찬, 박훈",국토연구원,2025년 12월,8000,7600,,	9791173500657,https://www.yes24.com/product/goods/189119427
76,도시재생사업 성과분석과 평가체계 개선방안,"임상연, 박정은, 조미향, 김소연, 정은진, 조현우, 주현정, 김성훈, 김영하, 윤병훈",국토연구원,2025년 12월,8000,7600,,	9791173500688,https://www.yes24.com/product/goods/189119426
77,노후주거지 실태와 정책적 대응방안,"박정은, 임상연, 임정하, 정연준, 김유란, 문대희, 오상영, 김명호, 원세용, 유영수",국토연구원,2025년 12월,9000,8550,,	9791173500701,https://www.yes24.com/product/goods/189119425
78,지방중소도시를 위한 새로운 토지이용 관리제도 도입방안,"김동근, 김승종, 신서경, 유예진, 조정희, 송지은, 박대근",국토연구원,2025년 12월,8000,7600,,	9791173500732,https://www.yes24.com/product/goods/189119424
79,국토의 계획 및 이용에 관한 법률 (2026),안재길,법률정보센타,2026년 03월,50000,50000,,	9788963765921,https://www.yes24.com/product/goods/189119423
80,인구구조 전환에 따른 부동산시장 영향과 향후 과제,"박진백, 김승훈, 최경아, 조미향, 오민준, 권건우, 김종근, 구형모",국토연구원,2025년 12월,9000,8550,,	9791173500718,https://www.yes24.com/product/goods/189119422
81,분쟁 취약국 대상 국토·도시부문 개발협력 방안,"양은모, 이병재, 유희연, 이소영, 박혜정, 조정우, 정윤희, 이원섭",국토연구원,2025년 12월,9000,8550,,	9791173500749,https://www.yes24.com/product/goods/189119421
82,대전환 시대의 지역발전 전략: 대규모 개발의 성과와 한계,"홍사흠, 유현아, 김찬용, 안유순, 최승비, 김성환, 하정석",국토연구원,2025년 12월,7000,6650,,	9791173500855,https://www.yes24.com/product/goods/189119420
83,개발제한구역 제도의 정책 성과 분석 연구,"유재성, 김중은, 김수지, 김동준, 이세원, 구지영, 이조은, 최정준",국토연구원,2025년 12월,7000,6650,,	9791173500756,https://www.yes24.com/product/goods/189119419
84,한국형 탄소중립도시 실현방안 연구(3):지역 수요 기반의 사업 지원 방안을 중심으로,"박종화, 윤은주, 서민호, 홍나은, 최소정, 조용혁, 이재현",국토연구원,2025년 12월,7000,6650,,	9791173500763,https://www.yes24.com/product/goods/189119418
85,메가트렌드에 대응한 도로정책 방전방안 연구 2:도로 모니터링 시스템 시범 구축을 중심으로,"박종일, 김준기, 김상록, 김재환, 김민영, 연복모, 김주현",국토연구원,2025년 12월,7000,6650,,	9791173500664,https://www.yes24.com/product/goods/189119417
86,"지방소멸시대, 세대별 다지역 거주 정책의 수용성과 추진 전략","김은란, 정유진, 서연미, 이우진, 신휴석, 곽병조",국토연구원,2025년 10월,8000,7600,,	9791173500459,https://www.yes24.com/product/goods/189119411
87,탄소중립 대응을 위한 산업입지 정책방향 연구,"김찬용, 조성철, 표희진, 오호영, 정민철, 송창현",국토연구원,2025년 10월,8000,7600,,	9791173500473,https://www.yes24.com/product/goods/189119410
88,이용자 행태 기반 스마트 인프라 구축 방안:전기차 충전 인프라와 에너지 전환 시대 대응 전략,"김수지, 이백진, 장요한, 김동준, 연치형, 고예강, 이준학",국토연구원,2025년 10월,7000,6650,,	9791173500497,https://www.yes24.com/product/goods/189119409
89,인구감소·저성장시대의 지속가능한 균형발전 실천전략,"정우성, 윤영모, 강민조, 이윤석, 유희연, 이우진, 조은주, 이동우, 박정윤",국토연구원,2025년 10월,9000,8550,,	9791173500503,https://www.yes24.com/product/goods/189119408
90,지역특성 기반의 생활인구 제도 확대방안 연구,"안소현, 차은혜, 김민지, 강민석, 곽병조",국토연구원,2025년 10월,8000,7600,,	9791173500510,https://www.yes24.com/product/goods/189119407
91,국토의 기반시설관리에 관한 디지털 전환 정책 방안 연구: 도로를 중심으로,"김광호, 정수교, 송재용, 이병재, 강준희, 심지섭",국토연구원,2025년 10월,7000,6650,,	9791173500527,https://www.yes24.com/product/goods/189119406
92,베이비부머 세대의 여가공간 이용 특성과 도시정책 과제,"정소양, 이진희, 김고은, 김태영",국토연구원,2025년 10월,8000,7600,,	9791173500534,https://www.yes24.com/product/goods/189119405
93,인구감소대응 콤팩트-네트워크 전략을 위한 생활권 변화 시뮬레이션 모형 개발 연구,"황명화, 임은선, 이보경, 이보라, 신휴석",국토연구원,2025년 12월,8000,7600,,	9791173500671,https://www.yes24.com/product/goods/189119404
94,공간구조 모니터링을 위한 관심지점(pol)빅데이터 활용방안:중심지 기능 및 계층구조 분석을 중심으로,"안승만, 이영민, 이보경, 변필성, 유재성, 최혜림",국토연구원,2025년 12월,7000,6650,,	9791173500695,https://www.yes24.com/product/goods/189119403
95,복지급여 신청주의 개선을 위한 연구,"김기태, 강신욱, 김태완, 노대명, 이현주",한국보건사회연구원,2025년 12월,16000,16000,,	9791172521424,https://www.yes24.com/product/goods/189119402
96,비아파트 소유 기피 현상과 주거정책 과제:청년 주거 안정을 중심으로,"윤성진, 조윤지, 최경아, 이다은, 조정희, 이길제, 구한민",국토연구원,2026년 05월,8000,7600,,	9791173500480,https://www.yes24.com/product/goods/189119401
97,주거복지정책 50년 평가와 정책방향,"강미나, 이재춘, 이다은, 이치주, 정서윤, 김허보람, 신영규, 이동우, 임덕영, 조인숙, 주보혜",국토연구원,2025년 12월,8000,7600,,	9791173500626,https://www.yes24.com/product/goods/189119400
98,행위자기반 부동산시장 시뮬레이션 모형 구축 연구(2),"전성제, 조만석, 오민준, 최진도, 최진, 신휴석, 안유순, 김정섭",국토연구원,2025년 12월,7000,6650,,	9791173500794,https://www.yes24.com/product/goods/189119399
99,국유지 관리방식의 전환연구,"이승욱, 박소영, 배유진, 김고은, 정민기, 백윤지, 이치주, 이수암, 오호영, 안정훈, 박정윤, 오경호",국토연구원,2025년 12월,8000,7600,,	9791173500879,https://www.yes24.com/product/goods/189119398
100,주거복지 정책간 연계 강화를 위한 소득 자산 기준 개선 방향 연구,"이길제, 이재춘, 조윤지, 이건우, 이봉조, 이원진, 임덕영, 주보혜",국토연구원,2024년 12월,9000,8550,,	9791173500077,https://www.yes24.com/product/goods/189119397
101,중국반도체산업의혁신과글로벌경쟁력,정형곤,대외경제정책연구원,2026년 02월,12000,12000,,	9788932219554,https://www.yes24.com/product/goods/189119396
